<?xml version="1.0" encoding="UTF-8"?>
   <xs:schema xmlns:xs="http://www.w3.org/2001/XMLSchema" elementFormDefault="qualified" attributeFormDefault="unqualified">
         <xs:element name="subset">
               <xs:complexType>
                     <xs:sequence>
                           <xs:element name="normForms">
                                 <xs:complexType>
                                       <xs:sequence>
                                             <xs:element name="normForm" maxOccurs="unbounded">
                                                   <xs:complexType>
                                                         <xs:sequence>
                                                               <xs:element name="fcsId" type="xs:int" maxOccurs="1"></xs:element>
                                                               <xs:element name="relationshipGroups" maxOccurs="unbounded">
                                                                     <xs:complexType>
                                                                           <xs:sequence>
                                                                                 <xs:element name="relationshipGroup" maxOccurs="unbounded">
                                                                                       <xs:complexType>
                                                                                             <xs:sequence>
                                                                                                   <xs:element name="relationships">
                                                                                                         <xs:complexType>
                                                                                                               <xs:sequence>
                                                                                                                     <xs:element name="relationship" maxOccurs="unbounded">
                                                                                                                           <xs:complexType>
                                                                                                                                 <xs:sequence>
                                                                                                                                       <xs:element name="attribute" type="xs:int"></xs:element>
                                                                                                                                       <xs:element name="destId" type="xs:int"></xs:element>
                                                                                                                                 </xs:sequence>
                                                                                                                           </xs:complexType>
                                                                                                                     </xs:element>
                                                                                                               </xs:sequence>
                                                                                                         </xs:complexType>
                                                                                                   </xs:element>
                                                                                             </xs:sequence>
                                                                                             <xs:attribute name="explicit" type="xs:string"></xs:attribute>
                                                                                       </xs:complexType>
                                                                                 </xs:element>
                                                                           </xs:sequence>
                                                                     </xs:complexType>
                                                               </xs:element>
                                                         </xs:sequence>
                                                   </xs:complexType>
                                             </xs:element>
                                       </xs:sequence>
                                 </xs:complexType>
                           </xs:element>
                     </xs:sequence>
               </xs:complexType>
         </xs:element>
   </xs:schema>